{"attempt_number":1,"authority_kind":"automatic","authority_metadata":{"authority_kind":"automatic","automation_identity":"sc_mv_dmer.rg01.formal_evaluator.v1"},"definition_id":"RG-01","evaluation_id":"RG-01-E1.4-attempt-1","evidence_bundle_sha256":"fd932b88e27eff5256adc0875c240ac411f523ebd5e0385b06f10ef79b3eb0bf","evidence_commit":"317703d8a91153c65979497db1180ec3d154a1d1","gate_version":"RG-01-v1","predecessor_dependencies":["evidence/qualifications/e1-1-mert-frame-rate-verification.json","evidence/qualifications/e1-2-mert-downstream-dimension-derivation-v2.json","evidence/qualifications/e1-3-mert-timegrid-binding-v2.json","manifests/upstream/mert-v1-95m-primary-v1.json"],"source_run_ids":["E1.1:P1_CANONICAL_EXACT_LENGTH","E1.1:P2_REAL_DEAM"],"verdict":"PASS"}
